fir_id,crime_type,severity,status,date,time,area,city,state,lat,lng,crime_description,victim_name,victim_gender,victim_age,victim_contact,victim_email,victim_address
FIR100334,Cybercrime,Medium,Active,2025-10-09,02:35:48,Jogeshwari East Ext Ext Ext Ext Ext Ext,Mumbai,Maharashtra,19.104799641578857,72.85608301234818,Itaque consectetur omnis laudantium maiores itaque voluptatum unde facilis inventore numquam iure totam.,Timothy Kanda,Other,70,+918275480157,yashoda86@example.com,"12, Kapoor, Bhopal-512137"
FIR100335,Drug Offense,Low,Pending,2025-07-13,22:11:09,Ghatkopar West Ext,Mumbai,Maharashtra,19.098725809668903,72.90316592524702,Explicabo libero necessitatibus nostrum fuga facilis tempora eveniet officiis porro harum.,Vanya Dua,Female,45,+916479473864,hemanginidugal@example.net,"H.No. 89, Gupta Marg, Ballia 708619"
FIR100336,Cybercrime,Low,Active,2025-06-13,18:38:28,Jogeshwari East Ext Ext Ext Ext,Mumbai,Maharashtra,19.114604086965524,72.84351398854085,Quae assumenda beatae maiores soluta vero enim asperiores dolore exercitationem cum est qui optio facilis.,Kashvi Sagar,Female,34,03175207167,kavya67@example.net,"H.No. 58, Gulati Road, Khammam-631138"
FIR100337,Kidnapping,Medium,Active,2025-07-10,06:27:57,Malad East Ext Ext Ext,Mumbai,Maharashtra,19.19310888092684,72.86132464562995,Velit tempora quo officia magnam quod asperiores officiis.,Tejas Kota,Male,45,1126691215,vasatikagill@example.com,"423, Dugar Marg, Visakhapatnam 347424"
FIR100338,Domestic Violence,Low,Resolved,2025-07-05,02:50:12,Goregaon East Ext Ext,Mumbai,Maharashtra,19.184361413738944,72.86628468227025,Soluta nostrum quae at rerum fugiat eos eos.,Sanya Wable,Female,58,+915396136749,qatwal@example.org,"10/437, Sagar, Panvel-085294"
FIR100339,Domestic Violence,Critical,Resolved,2025-07-27,19:42:25,Ghatkopar East,Mumbai,Maharashtra,19.08228469299449,72.92212253187199,Animi dignissimos ratione optio labore harum numquam ea dicta.,Faras Choudhury,Other,19,4657967842,umang43@example.org,"177, Bhatt Road, Firozabad-043502"
FIR100340,Cybercrime,Medium,Pending,2025-12-28,10:27:11,Kandivali East Ext,Mumbai,Maharashtra,19.200164154460513,72.85666997706623,Quas molestias error animi reprehenderit facere similique cupiditate vel ratione qui eligendi voluptatibus ab praesentium.,Yashasvi Jain,Male,42,01147732010,arunimadar@example.net,"H.No. 228, Mand, Katni-275233"
FIR100341,Domestic Violence,Medium,Active,2025-11-06,15:47:13,Cuffe Parade Ext Ext,Mumbai,Maharashtra,18.900394721498817,72.82872111872618,Dicta quo doloremque officia recusandae ad dolorum debitis quaerat reprehenderit temporibus facere rerum cum laboriosam et.,Nitesh Narang,Other,75,+917026952499,ishanvitara@example.com,"30/20, Narayanan Street, Chapra-330303"
FIR100342,Kidnapping,Medium,Active,2025-02-17,06:17:15,Kurla West Ext,Mumbai,Maharashtra,19.069172170828782,72.88678878394046,Aperiam ad unde laboriosam totam at reiciendis omnis temporibus eveniet illum assumenda tempore assumenda vitae.,Jackson Jha,Other,67,+911877347784,viswanathanvedant@example.net,"77, Das Zila, Sirsa-076279"
FIR100343,Burglary,Critical,Resolved,2025-10-15,01:40:22,Thane,Mumbai,Maharashtra,19.221641445970008,72.98059977798452,Dignissimos esse vitae voluptate ea magnam facilis architecto.,Gavin Uppal,Other,58,5880061675,janujabali@example.com,"024, Kade Path, Vijayawada 398472"
FIR100344,Cybercrime,Medium,Active,2025-10-07,22:04:57,Kurla West Ext,Mumbai,Maharashtra,19.077162760895757,72.89511976958747,Nobis placeat inventore debitis iure molestias assumenda laudantium enim consectetur.,Christopher Setty,Female,23,07700284276,narayanyashica@example.org,"420, Zachariah Street, Berhampore-901722"
FIR100345,Assault,Critical,Active,2025-10-04,07:32:37,Wadala Ext,Mumbai,Maharashtra,19.018662708459875,72.86068424232215,Corrupti quo nulla sunt provident magnam voluptatibus aliquam.,Yochana Sagar,Female,28,+914671978897,fariq07@example.net,"H.No. 507, Lad Marg, Kota-754619"
FIR100346,Drug Offense,Medium,Active,2025-03-06,23:17:58,Goregaon West Ext,Mumbai,Maharashtra,19.16795567890691,72.85927507228776,Nihil esse alias nulla veritatis amet molestias minus architecto fugit impedit.,Dalbir Shere,Other,74,08280647969,yashkunda@example.net,"H.No. 658, Yadav Ganj, Jamnagar-258122"
FIR100347,Domestic Violence,High,Resolved,2025-02-19,14:09:35,Ghatkopar West,Mumbai,Maharashtra,19.088689227821074,72.90954132737028,Culpa blanditiis nemo perspiciatis sit alias culpa perferendis deleniti hic natus repellendus.,Anthony Randhawa,Other,78,5450090255,yashkari@example.net,"56/68, Kumar Road, Shahjahanpur 337912"
FIR100348,Domestic Violence,Low,Pending,2025-07-02,19:38:52,Jogeshwari East,Mumbai,Maharashtra,19.1390854051567,72.8608912792394,Atque vero doloremque inventore similique id amet error unde sunt.,Aarush Kamdar,Male,55,9056165565,cgoel@example.net,"H.No. 101, Shankar Circle, Noida 869017"
FIR100349,Theft,High,Pending,2025-11-05,05:53:55,Malad East Ext,Mumbai,Maharashtra,19.184486566261675,72.8571689605798,Tenetur assumenda similique dolor molestias natus nulla suscipit.,Chakradev Sampath,Male,23,+913334911415,arunima13@example.net,"H.No. 03, Dora, Vasai-Virar 529517"
FIR100350,Murder,Low,Active,2025-06-07,02:59:43,Thane,Mumbai,Maharashtra,19.221759214396776,72.97942391324328,Enim eum sint beatae quam quos ad suscipit dolorum veritatis ea facilis adipisci laudantium.,Devansh Bhasin,Female,62,+910850769864,deochavvi@example.org,"276, Krish Road, Proddatur 220542"
FIR100351,Cybercrime,Critical,Pending,2025-12-03,17:56:33,Jogeshwari East Ext Ext Ext Ext Ext,Mumbai,Maharashtra,19.132204803321205,72.83536437075595,Tempora labore hic animi quaerat iste quibusdam corrupti provident officiis corrupti.,Urmi Balay,Female,28,+917905696591,vedantkohli@example.net,"26, Lad Path, Nellore-083344"
FIR100352,Vandalism,High,Resolved,2025-12-27,01:03:05,Kandivali West,Mumbai,Maharashtra,19.200586047139694,72.85143921220116,Repudiandae quidem distinctio hic saepe optio vero magnam.,Nilima Gole,Male,31,01357852945,gshetty@example.net,"H.No. 488, Trivedi Chowk, Ahmedabad 702059"
FIR100353,Domestic Violence,Medium,Resolved,2025-03-10,21:38:38,Dadar,Mumbai,Maharashtra,19.017676278096673,72.84996397111959,At voluptas perferendis voluptate amet quo porro ipsa.,Osha Prasad,Other,19,03718344049,nagarelijah@example.org,"H.No. 953, Taneja Chowk, South Dumdum-632956"
FIR100354,Drug Offense,Low,Pending,2025-05-03,15:49:38,Goregaon East Ext Ext,Mumbai,Maharashtra,19.16491577725652,72.86097815123148,Veritatis quis nemo fugiat quo animi id.,Saumya Purohit,Female,57,03919195419,cdada@example.org,"777, Garde Path, Secunderabad-061658"
FIR100355,Assault,Low,Pending,2025-04-11,21:28:39,Mulund West Ext Ext,Mumbai,Maharashtra,19.162312914988558,72.95090644389865,Ad exercitationem non illo nisi saepe id placeat doloribus quaerat voluptates dolorum porro animi.,Faris Zacharia,Other,20,7635148468,ghora@example.net,"20/59, Dora Street, Bhiwandi 563029"
FIR100356,Domestic Violence,High,Active,2025-04-10,23:59:36,Dadar Ext Ext,Mumbai,Maharashtra,19.02092930886319,72.8416387628135,Autem perspiciatis minima ab ad libero totam earum aliquid in dolorum dolor dolor adipisci.,Ijaya Dani,Male,72,03664987820,vidhimital@example.net,"96/363, Dube Chowk, Malegaon 206615"
FIR100357,Assault,Critical,Pending,2025-08-23,05:40:38,Bhandup Ext Ext,Mumbai,Maharashtra,19.15820268803472,72.9335281452209,Excepturi modi laudantium eligendi possimus possimus mollitia numquam officiis doloribus ex quasi sapiente.,Maya Wadhwa,Female,70,8297374896,saniisaac@example.net,"85/133, Kapoor Zila, Varanasi 983211"
FIR100358,Kidnapping,High,Active,2025-07-20,01:05:01,Jogeshwari West Ext,Mumbai,Maharashtra,19.13896380497169,72.84289957205743,Delectus minima suscipit totam saepe consequuntur fugiat veniam quia explicabo voluptatum beatae nulla beatae.,Udant Aggarwal,Female,52,0835723246,lhayer@example.net,"H.No. 215, Vaidya Road, Serampore-686876"
FIR100359,Kidnapping,Critical,Active,2025-03-22,07:10:20,Thane,Mumbai,Maharashtra,19.214409980987913,72.97734850842868,Veritatis quos vitae ullam maxime cumque quibusdam incidunt molestiae tenetur molestias laudantium id natus odio.,Chanchal Sheth,Male,50,05136442493,qacharya@example.com,"H.No. 918, Lala Path, Pali 420062"
FIR100360,Murder,Critical,Resolved,2025-07-09,06:02:11,Wadala,Mumbai,Maharashtra,19.02438235210009,72.86847838513884,Veritatis minus adipisci possimus illum ipsa maxime impedit tempore.,Ladli Karpe,Female,41,03123034778,waida25@example.net,"87/358, Rama Path, Ichalkaranji-419623"
FIR100361,Burglary,Low,Resolved,2025-04-08,19:28:50,Cuffe Parade Ext,Mumbai,Maharashtra,18.919316759095874,72.82244376615132,Maxime qui velit eaque hic laudantium at aliquam dolorem itaque exercitationem.,Triveni Pal,Male,36,06032420448,svarkey@example.net,"H.No. 926, Gola Street, Nellore 041042"
FIR100362,Vandalism,High,Resolved,2025-05-15,02:17:42,Mulund West,Mumbai,Maharashtra,19.16742316475258,72.93937920380814,Nemo laboriosam alias ea maiores a aut quibusdam earum.,Anya Gulati,Female,35,+910700159416,aishani83@example.com,"H.No. 478, Choudhury, Chittoor 269999"
FIR100363,Theft,High,Resolved,2025-07-25,09:40:34,Borivali East Ext,Mumbai,Maharashtra,19.224059534607797,72.84442754523367,Fuga debitis beatae est distinctio fugit architecto impedit.,Azad Saini,Male,66,01623198189,yahvi47@example.org,"28/318, Bhandari Nagar, Bhiwani 602000"
FIR100364,Murder,Critical,Pending,2025-05-04,16:38:57,Kurla East,Mumbai,Maharashtra,19.065825765993367,72.90136156145138,Blanditiis esse totam similique soluta asperiores maiores cumque quibusdam ad ex excepturi.,Wridesh Jhaveri,Female,69,4713915596,vinayaahuja@example.com,"28/538, Gulati Marg, Delhi 052438"
FIR100365,Fraud,High,Resolved,2026-01-01,08:04:11,Mulund East,Mumbai,Maharashtra,19.17449565677954,72.96282798764436,Earum voluptas tenetur cupiditate id voluptas fugit quidem unde velit voluptas voluptatibus libero at eaque ad.,Harrison Bandi,Other,78,3632123476,ktandon@example.org,"H.No. 82, Garg Marg, Allahabad-686276"
FIR100366,Theft,Medium,Pending,2026-01-20,18:01:21,Kurla West Ext,Mumbai,Maharashtra,19.070526620328984,72.89425579416631,Soluta perspiciatis odio et voluptatibus sed explicabo illum incidunt ab voluptatibus.,Chanakya Konda,Other,41,09078515867,sankarandaksha@example.org,"838, Rajan, Kakinada-618518"
FIR100367,Cybercrime,Medium,Resolved,2025-02-25,20:32:56,Kurla West Ext,Mumbai,Maharashtra,19.074764242256926,72.89263259238687,At veritatis officia consequuntur libero corrupti dolore minima.,Neelima Sarna,Other,62,3425754090,ooommen@example.net,"71, Saraf Ganj, Moradabad-132823"
FIR100368,Drug Offense,High,Pending,2025-07-18,19:54:45,Kurla East,Mumbai,Maharashtra,19.06854515544491,72.90236241450542,Iusto eaque commodi aut similique vitae ipsam sit dignissimos reiciendis doloremque facilis ratione animi neque saepe.,Teerth Bhalla,Female,52,0348645183,rishichopra@example.org,"H.No. 883, Grover Path, Ghaziabad-875067"
FIR100369,Fraud,High,Active,2025-12-06,20:35:45,Dadar Ext,Mumbai,Maharashtra,19.011171896632373,72.85449717113926,Iste voluptatem nesciunt ea quos non assumenda placeat tenetur alias beatae deleniti rem ratione sequi quidem.,Yahvi Mann,Female,79,06064413432,damyantithaker@example.com,"H.No. 065, Ganesh, Siwan-431927"
FIR100370,Fraud,Critical,Pending,2025-12-27,10:38:53,Jogeshwari East Ext Ext Ext Ext,Mumbai,Maharashtra,19.122103489600516,72.83627490517742,Dolores repellendus occaecati natus deleniti quia labore.,Eiravati Nagi,Other,18,05604177656,urmi14@example.net,"H.No. 781, Saini Path, Hosur-572026"
FIR100371,Murder,Medium,Pending,2025-12-25,07:00:56,Kandivali West Ext Ext,Mumbai,Maharashtra,19.205760717629637,72.84503564694032,Alias porro cupiditate laborum necessitatibus quae nemo soluta commodi repellat nisi explicabo eligendi quibusdam.,Chasmum Dhar,Other,53,+912481569857,mohammednaik@example.org,"68/629, Chandra Path, North Dumdum-349899"
FIR100372,Burglary,Medium,Resolved,2025-08-28,22:10:56,Goregaon East Ext Ext,Mumbai,Maharashtra,19.16300157139159,72.87716319152301,Nemo eos saepe voluptatem quibusdam labore possimus voluptas sapiente consectetur exercitationem magnam voluptas.,Odika Mital,Male,42,0027206345,meghanagarg@example.org,"H.No. 39, Saran Road, Raiganj-299074"
FIR100373,Murder,Low,Pending,2025-03-06,12:08:53,Chembur,Mumbai,Maharashtra,19.05015290494048,72.90186374281532,Impedit ut suscipit suscipit quaerat architecto voluptatibus dignissimos.,Darsh Gill,Male,62,1123829657,eshanavarty@example.com,"66/94, Sarma Zila, Shivpuri-808974"
FIR100374,Cybercrime,Critical,Active,2025-02-15,21:52:31,Wadala,Mumbai,Maharashtra,19.01862384323056,72.86264511800175,Itaque optio eligendi quibusdam nesciunt doloremque perferendis repellendus quae mollitia reprehenderit.,Warhi Batta,Male,66,02429543165,oluthra@example.com,"59/94, Majumdar Marg, Danapur-984167"
FIR100375,Domestic Violence,Low,Active,2025-10-07,07:00:30,Jogeshwari East Ext,Mumbai,Maharashtra,19.12820794243091,72.85448417382848,Eius quasi non quaerat porro placeat aliquid at accusamus nam veniam commodi quae.,Lakshmi Vohra,Other,77,+916693008931,xmitter@example.org,"85, Rastogi Ganj, Nadiad-980445"
FIR100376,Domestic Violence,Medium,Resolved,2025-08-24,09:12:47,Kandivali West Ext,Mumbai,Maharashtra,19.21232695099973,72.85136041527781,Odio excepturi illo asperiores qui aliquam earum voluptatum veniam necessitatibus nam.,Omaja Rege,Other,79,03420696942,gauri55@example.com,"86/052, Balay Zila, Silchar 706648"
FIR100377,Burglary,Critical,Active,2025-12-17,23:24:28,Mulund West,Mumbai,Maharashtra,19.17599228053632,72.94444640958893,Praesentium sequi cupiditate provident odio suscipit doloribus quae.,Charita Puri,Other,60,+915291086771,pavani96@example.com,"24/84, Venkatesh Path, Korba 889830"
FIR100378,Cybercrime,High,Pending,2025-02-01,09:13:20,Bhandup Ext Ext,Mumbai,Maharashtra,19.161593616538592,72.93330029507096,Ratione suscipit tempora dicta distinctio cumque modi iusto facere.,Urvashi Khosla,Male,51,+913344762639,ravalchristopher@example.com,"H.No. 88, Som Ganj, Aligarh 630275"
FIR100379,Burglary,Critical,Active,2025-03-04,00:33:46,Jogeshwari East Ext Ext Ext Ext Ext Ext,Mumbai,Maharashtra,19.11175370196151,72.85400602428787,Omnis nemo mollitia optio aliquid consequuntur suscipit fugiat odio veritatis iusto repudiandae exercitationem.,Charita Dhawan,Female,42,+914362620443,logan74@example.org,"H.No. 305, Rau Marg, Guntakal 305641"
FIR100380,Assault,High,Resolved,2026-01-21,15:37:43,Mulund East,Mumbai,Maharashtra,19.17471495701248,72.96164635026925,Consectetur quas voluptates saepe sint vero vero perferendis maxime nisi asperiores quam a quas blanditiis.,Dalbir Sachar,Other,33,7359710725,sathvikkunda@example.com,"84, Sen Marg, Ambala 018726"
FIR100381,Domestic Violence,High,Pending,2025-11-15,19:05:18,Malad West Ext,Mumbai,Maharashtra,19.19582256394169,72.84648374808835,Blanditiis error illo ducimus quae aspernatur aut nesciunt magnam animi nemo facilis esse.,Krish Rama,Female,51,6366941180,arjun56@example.com,"H.No. 365, Batta Zila, Gopalpur 442990"
FIR100382,Fraud,Critical,Resolved,2025-12-22,02:52:33,Bhandup Ext Ext,Mumbai,Maharashtra,19.156985937199227,72.93089494629304,Sit laudantium vero repellendus perferendis totam similique quisquam voluptas delectus libero.,Aadhya Jani,Female,46,+915375990048,ryan39@example.net,"H.No. 56, Rattan Circle, Dehradun-062215"
FIR100383,Vandalism,High,Pending,2025-04-28,15:17:53,Kurla East,Mumbai,Maharashtra,19.06700476042176,72.90218025243145,Voluptas nam saepe quas itaque animi nam suscipit odio excepturi cupiditate ut culpa quibusdam.,Farhan Sengupta,Female,36,6465280924,gmahal@example.org,"25, Gokhale Marg, Bokaro 905334"
FIR100384,Drug Offense,Low,Active,2025-04-01,10:15:04,Bhandup Ext,Mumbai,Maharashtra,19.157940708189777,72.93321899578306,Repudiandae mollitia cum cumque laboriosam voluptas animi illum illo quas corrupti inventore tenetur sapiente molestias.,George Wason,Male,40,+918757215862,naveennanda@example.net,"H.No. 74, Ramachandran Chowk, Hosur-559396"
FIR100385,Cybercrime,Medium,Resolved,2025-07-03,07:44:11,Goregaon West Ext,Mumbai,Maharashtra,19.166456330644774,72.85518074328478,Repudiandae officia facere aperiam esse quidem pariatur consequatur autem quaerat.,Charan Loyal,Female,36,01502745644,csinghal@example.net,"H.No. 383, Ahuja Path, Jodhpur 455312"
FIR100386,Theft,High,Resolved,2025-08-03,22:31:31,Malad West Ext,Mumbai,Maharashtra,19.194636334919387,72.84074790811026,Deleniti voluptatibus iusto rerum quibusdam sapiente accusantium.,Balveer Bora,Other,42,4856257287,psur@example.com,"36/221, Sodhi Zila, Asansol 726488"
FIR100387,Burglary,Low,Pending,2025-08-01,22:59:18,Goregaon West Ext Ext,Mumbai,Maharashtra,19.16162904633629,72.85580481290361,Repellat laborum quod minus maiores quasi ullam.,Teerth Srinivas,Male,33,+913203207427,gbhargava@example.org,"55/85, Golla Street, Tirunelveli-251618"
FIR100388,Drug Offense,High,Resolved,2025-04-20,19:59:09,Jogeshwari West Ext,Mumbai,Maharashtra,19.136704806416653,72.84443391782501,Quibusdam vel dolore alias reiciendis recusandae provident necessitatibus suscipit maiores earum earum culpa.,Gaurangi Mitter,Other,71,01707587771,anya85@example.com,"H.No. 91, Bhavsar Chowk, Naihati 805491"
FIR100389,Theft,Medium,Pending,2025-12-28,11:03:28,Jogeshwari West Ext,Mumbai,Maharashtra,19.144362190434652,72.8450739079511,Laudantium esse ipsam illum placeat nulla expedita sequi reiciendis perferendis eaque excepturi et.,Siddharth Gupta,Other,68,2151342284,indrajit72@example.net,"44, Karpe Chowk, Kakinada 247841"
FIR100390,Drug Offense,Low,Pending,2025-07-01,04:41:13,Malad East Ext Ext Ext,Mumbai,Maharashtra,19.178355584370593,72.8591219416793,Incidunt hic perspiciatis at nisi cum aut voluptatum earum.,Varenya Kibe,Male,26,9390892613,nairodika@example.org,"H.No. 94, Sharaf, Bhilwara-930537"
FIR100391,Vandalism,Medium,Pending,2026-01-12,07:49:25,Kurla West,Mumbai,Maharashtra,19.072293497420397,72.88019576449275,Neque a ullam aliquam esse quisquam quidem aperiam ipsa debitis nostrum voluptate animi commodi.,Mekhala Khatri,Other,18,01504165915,chandaniiyengar@example.net,"183, Chacko Marg, Kollam 892608"
FIR100392,Theft,Medium,Pending,2025-02-18,01:05:42,Jogeshwari East Ext Ext Ext Ext,Mumbai,Maharashtra,19.12745987737041,72.82968807999154,Optio temporibus exercitationem veritatis fuga ipsam dolores nostrum quaerat alias voluptatibus quidem reprehenderit.,Barkha Rai,Other,59,+910177749050,sarmayatan@example.com,"15/27, Soman Circle, Bangalore-862515"
FIR100393,Murder,Low,Active,2025-03-31,10:53:36,Andheri West Ext,Mumbai,Maharashtra,19.12869901859769,72.83417870256433,Quasi dolorem assumenda maiores corporis corrupti iure.,Jagrati Morar,Male,36,9759230450,bishakha02@example.org,"46, Kala Path, Kamarhati-801891"
FIR100394,Kidnapping,Low,Pending,2025-06-23,20:56:47,Jogeshwari East Ext Ext Ext,Mumbai,Maharashtra,19.12454544175435,72.83635830214952,Facilis commodi provident dicta quis nemo voluptatem aperiam reiciendis saepe sunt id unde illum.,Jagvi Varghese,Other,50,1896164236,jalsa73@example.org,"73/446, Chahal Chowk, Mango 296914"
FIR100395,Murder,Low,Resolved,2025-01-27,04:23:15,Goregaon West Ext,Mumbai,Maharashtra,19.164345818646545,72.84967703813626,Deserunt laudantium dolorem voluptatibus consectetur minus explicabo id quo quo.,Unnati Chaudhari,Female,51,+910326642147,upadhriti37@example.com,"29, Kurian, Chinsurah-509999"
FIR100396,Domestic Violence,Critical,Active,2025-06-27,19:40:17,Wadala Ext,Mumbai,Maharashtra,19.019653522390023,72.85348688231713,Iure tempora rerum repellendus libero debitis excepturi neque aut doloremque.,Ekaja Jani,Other,33,04925158377,rushil44@example.net,"H.No. 089, Oak Circle, Ambattur 835211"
FIR100397,Kidnapping,Low,Resolved,2025-05-09,03:06:32,Goregaon West Ext,Mumbai,Maharashtra,19.167560926009408,72.85997199314092,Quaerat repudiandae quasi quaerat amet molestiae nesciunt consequuntur dignissimos vel.,Dhriti Sachdev,Female,61,07499616592,deyjagdish@example.net,"H.No. 24, Malhotra Marg, Udupi-957285"
FIR100398,Murder,Low,Active,2026-01-21,23:31:50,Goregaon West Ext,Mumbai,Maharashtra,19.16701615032079,72.85984455958572,Dignissimos ipsum eaque deleniti suscipit deserunt commodi.,Timothy Dhingra,Other,57,06108573278,zsane@example.com,"95/828, Behl Zila, Asansol-797891"
FIR100399,Kidnapping,Low,Pending,2025-11-27,08:16:40,Jogeshwari East,Mumbai,Maharashtra,19.140539585075526,72.86097919186957,Modi repellat distinctio eligendi id quisquam assumenda facere laborum molestias ullam earum dolor aut minima quae.,Advika Sahni,Male,72,8147617422,wadhwadarpan@example.net,"83/97, Shere Zila, Ozhukarai-451436"
FIR100400,Kidnapping,Low,Active,2025-11-27,01:28:23,Lower Parel Ext,Mumbai,Maharashtra,19.00236215655103,72.84606132525016,Fuga vel perspiciatis labore in omnis molestiae tempora officiis harum fuga provident esse quas porro atque.,Michael Hayre,Male,35,4386490810,amol96@example.org,"68/11, Kalla Street, Bhagalpur-681193"
FIR100401,Fraud,High,Active,2025-07-22,02:33:57,Thane,Mumbai,Maharashtra,19.218501698923106,72.97635290618362,Pariatur molestiae dolore nulla culpa enim eum quae occaecati ipsum officia voluptatibus nobis minima.,Victor Raghavan,Other,51,1866179454,vyanjana49@example.com,"H.No. 59, Bajaj Nagar, Vasai-Virar-790552"
FIR100402,Burglary,Critical,Resolved,2025-05-17,19:30:53,Ghatkopar West,Mumbai,Maharashtra,19.082428759613393,72.91200960895691,Nulla ea vitae minima nam odio nemo dolore itaque tenetur iusto totam.,Xalak Nazareth,Male,42,1801722601,borrageorge@example.net,"33/51, Thaman Path, Madhyamgram-532601"
FIR100403,Burglary,Medium,Resolved,2025-07-10,23:16:32,Jogeshwari East Ext Ext Ext,Mumbai,Maharashtra,19.131581145196115,72.84388591205231,Similique perspiciatis aspernatur fuga dolores atque magni quidem repudiandae in exercitationem facilis aspernatur placeat adipisci.,Vrinda Swaminathan,Other,78,04597794523,walinathan@example.net,"10/38, Som Street, Guntur 513609"
FIR100404,Fraud,Low,Pending,2025-10-24,20:54:57,Dadar Ext Ext Ext,Mumbai,Maharashtra,19.027488504232807,72.84307610315948,Accusamus ipsa soluta qui minima odit quisquam illo itaque voluptatibus laudantium iusto.,Om Pandey,Male,62,+911941680061,sidhurayaan@example.org,"18/10, Narang Road, Bhavnagar 373615"
FIR100405,Drug Offense,High,Active,2025-11-06,11:37:09,Kandivali East,Mumbai,Maharashtra,19.20556695422818,72.87214871347756,Repudiandae neque minus doloribus nam facere nulla tempora a minus delectus.,Logan Suresh,Female,23,+912776974995,dmalhotra@example.com,"62, Brar Chowk, Karnal-933539"
FIR100406,Assault,High,Active,2025-11-27,23:13:12,Lower Parel Ext,Mumbai,Maharashtra,18.999679887806227,72.83967023072191,Sequi fugit corrupti eveniet necessitatibus id tenetur ipsam dignissimos.,Daniel Viswanathan,Other,38,6412203103,gangabora@example.org,"58/561, Manne Path, Shahjahanpur 566397"
FIR100407,Drug Offense,High,Active,2025-08-30,14:39:33,Jogeshwari East Ext Ext Ext,Mumbai,Maharashtra,19.12516596732208,72.8396913593059,Dolorem nobis nostrum totam enim dicta natus eum quia impedit ipsa optio facilis.,Falan Bava,Female,75,+913723683147,sudiksha86@example.org,"H.No. 11, Mannan Marg, Singrauli-283772"
FIR100408,Theft,Medium,Pending,2025-10-11,08:19:56,Sion Ext,Mumbai,Maharashtra,19.034187461887687,72.86183745488414,Iusto maiores dolor amet qui at optio qui.,Nitara Devan,Female,23,+917601227770,amemon@example.net,"896, Rout Marg, Tiruvottiyur-428164"
FIR100409,Theft,Low,Pending,2025-11-02,14:20:39,Goregaon West Ext,Mumbai,Maharashtra,19.15806296678254,72.84505284580874,Velit fugit fugiat placeat voluptate expedita hic recusandae dignissimos provident delectus veniam dignissimos ullam.,Ekansh Dora,Other,49,09334960501,abahl@example.org,"61/019, Naik Chowk, Thanjavur 640510"
FIR100410,Kidnapping,Critical,Pending,2025-08-04,21:21:59,Goregaon East Ext Ext,Mumbai,Maharashtra,19.185079653091634,72.87006887054007,Eaque distinctio voluptatem incidunt hic reiciendis neque alias ab molestias inventore quam quas quibusdam.,Tejas Tiwari,Female,58,6679984076,prisha24@example.org,"730, Dhar Road, Gurgaon-628144"
FIR100411,Murder,Critical,Pending,2025-03-28,18:03:01,Borivali East,Mumbai,Maharashtra,19.22717586795261,72.85476639249426,Voluptate quia impedit esse quidem quo nam necessitatibus porro optio.,Kashvi Bhasin,Other,65,08997308069,tanvi39@example.com,"H.No. 893, Nadig, Lucknow 906764"
FIR100412,Murder,High,Pending,2025-04-10,20:55:03,Kurla West Ext,Mumbai,Maharashtra,19.070469422060256,72.89251105092424,Facere facilis vel at voluptatibus recusandae ratione nulla ad dicta atque impedit totam quo omnis.,Vinaya Babu,Female,60,08146717957,ranbirdivan@example.org,"884, Upadhyay, Gopalpur 513587"
FIR100413,Burglary,Medium,Resolved,2025-05-22,14:57:39,Jogeshwari West,Mumbai,Maharashtra,19.14541129139237,72.84556665053027,Odit nam accusamus expedita laudantium doloribus earum ipsa nemo error totam recusandae.,Nisha Arora,Other,56,6024375738,pratyush10@example.net,"H.No. 743, Sandal Nagar, Aligarh-403439"
FIR100414,Cybercrime,Medium,Active,2025-04-21,06:24:34,Goregaon West Ext,Mumbai,Maharashtra,19.151878961427748,72.86248946127917,Molestiae quisquam sunt quia ratione velit eveniet magnam nemo omnis.,Anvi Wason,Other,48,+919597246657,dattaijaya@example.org,"877, Vala Path, Muzaffarpur 647704"
FIR100415,Drug Offense,Medium,Active,2025-02-18,08:41:21,Goregaon West Ext,Mumbai,Maharashtra,19.155831545619247,72.8514959402224,Ipsa ullam assumenda deleniti molestiae tempora qui ipsam nisi ullam molestiae dolores ipsum.,Anay Thakkar,Male,59,+919341722329,divya33@example.org,"09/091, Hans Path, Lucknow 826254"
FIR100416,Domestic Violence,Critical,Active,2025-09-08,17:13:41,Malad West,Mumbai,Maharashtra,19.18926976487456,72.84581496485256,Repellendus explicabo non illo eum dolor aliquam culpa eum corrupti.,Praneel Chhabra,Other,27,01674338005,nihal64@example.org,"H.No. 12, Chada Ganj, Raurkela Industrial Township-720441"
