fir_id,crime_type,severity,status,date,time,area,city,state,lat,lng,crime_description,victim_name,victim_gender,victim_age,victim_contact,victim_email,victim_address
FIR100584,Theft,Critical,Pending,2025-02-11,17:40:44,Bhandup Ext Ext,Mumbai,Maharashtra,19.155164646647496,72.92469721417982,Itaque id officia sit saepe enim ut porro fugit error velit.,Wriddhish Talwar,Other,41,05859883103,braval@example.com,"31/00, Mane Marg, Kakinada 262277"
FIR100585,Burglary,Critical,Active,2026-01-11,04:16:15,Jogeshwari East Ext Ext Ext Ext,Mumbai,Maharashtra,19.123258727284075,72.83424524132687,Eligendi voluptatibus a debitis commodi dolorem quae recusandae numquam possimus corporis dolorum.,Isaiah Khosla,Male,28,+913243298395,swaminathanarjun@example.com,"316, Bandi Circle, Rewa-707038"
FIR100586,Fraud,High,Resolved,2025-06-14,21:08:08,Dadar Ext,Mumbai,Maharashtra,19.008556448247127,72.85919412526344,A saepe assumenda ipsam pariatur dolorem harum totam ullam reiciendis unde.,Ekavir Wable,Male,43,02961844626,nagyveda@example.net,"605, Munshi, Ambala 241074"
FIR100587,Vandalism,Medium,Resolved,2025-04-18,06:47:55,Bhandup Ext Ext,Mumbai,Maharashtra,19.156817501875146,72.92767123971515,Iusto amet optio impedit recusandae dolorum necessitatibus sequi aspernatur ipsam voluptatum.,Jalsa Nadig,Other,68,01462831435,fmohan@example.com,"40, Solanki Marg, Guna 676259"
FIR100588,Murder,Low,Resolved,2025-10-18,15:55:40,Bhandup,Mumbai,Maharashtra,19.146499790286597,72.93703180863314,Autem deleniti consequatur ea quis assumenda debitis totam cumque odio laborum id.,Lila Salvi,Other,79,8926256609,wablebenjamin@example.org,"003, Halder Marg, Sambhal 614974"
FIR100589,Domestic Violence,Low,Resolved,2025-05-03,17:27:27,Bandra East,Mumbai,Maharashtra,19.064636496640517,72.85238230421082,Maiores temporibus excepturi ducimus rerum minus veritatis excepturi commodi dolor deserunt hic quasi.,Orinder Sinha,Female,51,+911418186151,mohantyoscar@example.net,"93/183, Sundaram, Khora  498609"
FIR100590,Cybercrime,Low,Pending,2025-10-13,23:09:37,Ghatkopar East,Mumbai,Maharashtra,19.08381192529164,72.91831403779068,Consequuntur excepturi velit reiciendis architecto temporibus possimus.,Anay Bir,Other,45,05423401636,chanakya80@example.org,"H.No. 493, Saha Street, Sagar 223946"
FIR100591,Vandalism,High,Active,2025-03-07,02:11:42,Ghatkopar West,Mumbai,Maharashtra,19.088931428739965,72.91159794674812,Mollitia ipsa nostrum pariatur quas molestias natus provident debitis rem nihil cumque.,Adweta Kale,Female,20,+911284971859,lekha35@example.net,"H.No. 289, Borde Circle, Ozhukarai 853400"
FIR100592,Assault,Critical,Pending,2025-06-13,08:23:18,Colaba,Mumbai,Maharashtra,18.910237849217047,72.81376804800952,Sint officia aut eligendi necessitatibus tenetur earum beatae beatae ab assumenda repellendus vero possimus id neque.,Darpan Rao,Other,28,08491025625,sarafyashoda@example.net,"76/223, Wali, Mehsana 225678"
FIR100593,Domestic Violence,Medium,Active,2025-11-25,15:17:05,Jogeshwari West Ext Ext,Mumbai,Maharashtra,19.1433402663211,72.83800709037455,Neque eligendi cumque eum ab blanditiis cum quae autem error.,Yachana Sagar,Male,55,8896792408,yashodaprabhakar@example.net,"88/22, Seshadri Ganj, Howrah-841680"
FIR100594,Vandalism,High,Active,2025-09-01,21:52:41,Kandivali West Ext Ext,Mumbai,Maharashtra,19.21463796903109,72.84693492620538,Corrupti nulla magni esse esse nulla magnam.,Neelima Butala,Other,78,2226940539,kalahardik@example.com,"34/956, Sibal Road, Katni-586794"
FIR100595,Burglary,Critical,Active,2026-01-05,23:21:11,Mulund East Ext Ext,Mumbai,Maharashtra,19.173913973399696,72.96452536957065,Hic facilis error asperiores molestiae iure vel nobis dolorum harum suscipit eveniet non aut impedit.,Arunima Chacko,Male,31,07275784468,timothynagarajan@example.org,"83/097, Jaggi Street, Jamshedpur-809261"
FIR100596,Cybercrime,High,Pending,2026-01-01,04:34:06,Kandivali East,Mumbai,Maharashtra,19.21011429810362,72.86496002027864,Possimus nemo voluptatum vitae deleniti corrupti beatae omnis tempora atque aperiam.,Farhan Vaidya,Male,68,3414651113,warhijhaveri@example.net,"016, Parekh Path, Hospet-457865"
FIR100597,Burglary,Medium,Active,2025-07-03,06:32:05,Malad East Ext Ext Ext,Mumbai,Maharashtra,19.193078865309676,72.85657726305486,Sunt dolor facere repudiandae modi cupiditate vitae enim molestiae vel voluptate quas.,Nachiket Yadav,Male,43,+912901487068,bathlakshmi@example.org,"51, Kumar Street, Chinsurah 000687"
FIR100598,Cybercrime,Critical,Pending,2025-09-25,06:12:07,Ghatkopar West Ext,Mumbai,Maharashtra,19.096268557535982,72.9075002928396,Sunt soluta ullam hic velit labore aspernatur doloribus quos.,Mahika Bhatti,Female,65,2778816093,mannanaayush@example.org,"24/05, Sachdeva Zila, Nagercoil 512244"
FIR100599,Assault,High,Resolved,2025-11-14,01:58:50,Borivali East Ext,Mumbai,Maharashtra,19.239027138290258,72.8544804602252,Voluptatum est vel voluptas sunt culpa modi.,Rajeshri Khare,Other,38,0685389097,peter63@example.com,"99/74, Dhawan Nagar, Panihati 860835"
FIR100600,Domestic Violence,Medium,Resolved,2025-03-28,02:25:43,Mulund East Ext Ext,Mumbai,Maharashtra,19.177640114150833,72.96257817316321,Reiciendis repellendus labore adipisci quo nulla quasi officiis odio optio nihil modi odit.,Yash Chadha,Male,71,+918321528506,jbasu@example.org,"17/036, Bath Ganj, Agartala-386020"
FIR100601,Murder,Low,Active,2026-01-21,00:18:09,Andheri West Ext,Mumbai,Maharashtra,19.125046597801557,72.83117998950493,Provident tenetur esse voluptas praesentium tempore libero sint asperiores ipsum excepturi recusandae sapiente.,Jack Setty,Male,73,06251538144,aarnasami@example.net,"98/30, Mall, Rajpur Sonarpur 909619"
FIR100602,Burglary,Medium,Pending,2026-01-23,01:38:29,Kandivali West,Mumbai,Maharashtra,19.204069958856657,72.8515962446205,Accusantium rerum praesentium sunt fuga asperiores porro.,Dayamai Gill,Female,56,04430963480,samarth46@example.net,"72/45, Luthra Street, Bhagalpur-694804"
FIR100603,Burglary,Low,Resolved,2025-04-28,14:12:29,Cuffe Parade,Mumbai,Maharashtra,18.91113560935379,72.82184745248577,Quaerat laudantium totam eligendi iure voluptate exercitationem delectus expedita suscipit ipsa repellat voluptates nihil dignissimos debitis.,Advik Devan,Other,47,09705097545,sagarodika@example.com,"35, Swamy Marg, Danapur 957394"
FIR100604,Drug Offense,High,Pending,2025-12-28,02:04:21,Dadar Ext Ext Ext,Mumbai,Maharashtra,19.013285869479752,72.83153650093632,Quibusdam veritatis quae doloremque mollitia praesentium dolor omnis rem cumque unde nemo tenetur.,Nihal Taneja,Other,76,+910526501673,ranveer74@example.net,"80/26, Ganguly Nagar, Gopalpur 031589"
FIR100605,Cybercrime,Critical,Pending,2025-03-31,23:08:49,Jogeshwari East Ext,Mumbai,Maharashtra,19.13235993199031,72.85119471287483,Voluptas occaecati quod itaque officiis maiores laboriosam voluptates ullam earum.,Zansi Lad,Female,25,+918826170243,ranabenjamin@example.net,"49/07, Muni Ganj, Thane-197774"
FIR100606,Kidnapping,Critical,Active,2025-12-03,11:44:34,Bhandup Ext Ext,Mumbai,Maharashtra,19.167354367960943,72.93483487149345,Explicabo totam quo doloremque maxime nobis neque architecto aspernatur incidunt.,Kamya Date,Female,68,06545628417,qdave@example.net,"H.No. 95, More Zila, Anand-482308"
FIR100607,Domestic Violence,High,Resolved,2025-12-07,18:25:36,Powai,Mumbai,Maharashtra,19.11660107649784,72.9072166725963,Nihil perferendis officiis eum est iusto animi ab iusto sequi omnis libero fugiat quam mollitia quo.,Jacob Balan,Other,37,7225605313,ekavircontractor@example.org,"86/841, Salvi, Sambalpur-260586"
FIR100608,Cybercrime,Critical,Active,2025-04-05,02:17:36,Colaba,Mumbai,Maharashtra,18.909625951162884,72.81111223543374,Necessitatibus omnis non recusandae id quos itaque magnam provident impedit quisquam.,Pushti Magar,Female,65,00266502374,vrindabhavsar@example.org,"67, Varty Road, Navi Mumbai 306629"
FIR100609,Drug Offense,Critical,Active,2026-01-04,01:58:21,Jogeshwari East Ext Ext Ext Ext,Mumbai,Maharashtra,19.13068021742367,72.8350600901212,Molestias accusamus eveniet neque asperiores quos ducimus eius facere quibusdam.,Adya Bose,Other,49,+916787256862,oliver46@example.com,"H.No. 18, Sidhu Zila, Durg-655946"
FIR100610,Theft,Low,Resolved,2025-07-06,15:30:50,Kandivali West Ext,Mumbai,Maharashtra,19.201955500427697,72.8545966431689,Tempore nesciunt excepturi deserunt sapiente deleniti alias eveniet architecto.,Tamanna Vaidya,Other,39,+911022580305,bhavani94@example.org,"327, Kannan Street, Kochi 989022"
FIR100611,Cybercrime,High,Resolved,2025-02-05,14:39:44,Lower Parel,Mumbai,Maharashtra,19.002301356044054,72.83538643063115,Atque impedit optio explicabo ullam provident totam ad illum est autem.,Christopher Tata,Male,76,09067447163,ranasaksham@example.org,"90/065, Sem Road, Suryapet-779541"
FIR100612,Murder,Medium,Pending,2025-04-06,09:30:03,Dadar,Mumbai,Maharashtra,19.018014596387214,72.84498709800324,Voluptate rem inventore illo explicabo non velit excepturi adipisci aperiam.,Jhalak Dugar,Male,24,2823414363,iiyer@example.net,"55, Vohra Ganj, Tinsukia-737815"
FIR100613,Domestic Violence,Low,Resolved,2025-11-09,04:50:38,Ghatkopar East Ext,Mumbai,Maharashtra,19.0809423936508,72.9088457589892,Libero ullam consequuntur dolores consequatur sint laborum magnam repellat sit.,Harshil D’Alia,Other,26,01892392312,singhvarenya@example.org,"90, Mittal Circle, Sasaram 268384"
FIR100614,Drug Offense,High,Pending,2026-01-21,22:23:53,Jogeshwari East Ext Ext,Mumbai,Maharashtra,19.12955249438619,72.85125243657853,Voluptatibus dicta veritatis perspiciatis dolor repudiandae beatae.,Yashodhara Agate,Other,62,00432609310,karnikbaljiwan@example.com,"802, Srinivas Nagar, Vijayawada-396121"
FIR100615,Theft,Low,Pending,2025-06-05,03:20:11,Malad East Ext Ext Ext,Mumbai,Maharashtra,19.174941459225163,72.86166752642798,Aspernatur aperiam recusandae minima numquam quas quibusdam explicabo similique perferendis qui sed eum consequuntur reprehenderit.,Advik Konda,Other,18,06843356708,fiyazbir@example.org,"18/812, Zacharia, Navi Mumbai 070669"
FIR100616,Fraud,Medium,Pending,2025-11-26,03:59:40,Dadar Ext,Mumbai,Maharashtra,19.016207901437525,72.84789582062261,Temporibus ipsam et neque doloribus sequi tempora dolor.,Urmi Patla,Other,46,00414545635,cprabhakar@example.net,"H.No. 792, Srivastava Ganj, Giridih 689334"
FIR100617,Drug Offense,Medium,Resolved,2026-01-23,22:40:14,Kurla West Ext Ext,Mumbai,Maharashtra,19.06137409474356,72.88433625744979,Esse sapiente dignissimos voluptatibus autem accusamus modi illo.,Mason Gola,Other,25,+912000534749,riyabarman@example.net,"70/35, Salvi Nagar, Khammam-896833"
FIR100618,Fraud,High,Active,2025-07-05,17:02:36,Andheri East,Mumbai,Maharashtra,19.115073403158192,72.86381260469938,Amet inventore quisquam quos neque ea rerum ad repellendus minus.,Oni Kapur,Other,73,+916247554110,shivanshnadkarni@example.org,"70/773, Garde Zila, Salem 550570"
FIR100619,Domestic Violence,Medium,Pending,2025-12-04,10:47:47,Thane Ext,Mumbai,Maharashtra,19.2263550046515,72.96877679344023,Reiciendis doloribus impedit molestias fuga at alias aliquid architecto corrupti asperiores ducimus molestias ipsum consequatur.,Yuvraj Saha,Female,71,8255598953,duaharita@example.com,"18/799, Varty Ganj, Parbhani 045883"
FIR100620,Burglary,Low,Active,2025-10-14,15:28:36,Cuffe Parade Ext Ext Ext,Mumbai,Maharashtra,18.910602234042855,72.82931989903577,Voluptas aperiam odio iusto ipsum recusandae deleniti quis eligendi non laboriosam.,Anika Brahmbhatt,Other,21,4396112910,inayashere@example.org,"H.No. 14, Behl Chowk, Jamnagar 503687"
FIR100621,Drug Offense,Medium,Active,2025-12-28,19:44:15,Sion,Mumbai,Maharashtra,19.037126997438087,72.86487732263349,Distinctio consectetur accusantium deleniti est libero distinctio.,Jagdish Thakkar,Female,52,3371189547,ramanlajita@example.org,"68/910, Sarma, Tadipatri 802344"
FIR100622,Assault,Low,Resolved,2025-11-08,21:19:21,Ghatkopar East Ext,Mumbai,Maharashtra,19.088244806171378,72.92453631487827,Esse consectetur aliquam facere sit rem eos hic aperiam occaecati.,Praneel Kapoor,Female,76,+918202368485,yashasvi13@example.org,"44/67, Memon, Ahmednagar 640163"
FIR100623,Fraud,Low,Active,2025-12-07,14:41:57,Bandra East Ext,Mumbai,Maharashtra,19.073228909771277,72.85103811914537,Dicta doloremque facilis vero iste esse aliquid iusto.,Nandini Biswas,Other,20,07161768802,gautamisarna@example.org,"37, Joshi Circle, Raichur-572927"
FIR100624,Murder,Medium,Active,2025-05-03,20:49:44,Mulund East Ext,Mumbai,Maharashtra,19.17872601453981,72.95735772632233,Placeat consectetur doloremque vero incidunt similique possimus consectetur assumenda.,Barkha Mukhopadhyay,Other,71,4240903678,pboase@example.net,"68/30, Chakrabarti Street, Karaikudi-423324"
FIR100625,Assault,High,Resolved,2025-05-10,18:14:12,Kurla East,Mumbai,Maharashtra,19.060721031167763,72.90285120851496,Recusandae asperiores minima quisquam tempora nam neque libero mollitia sed iste incidunt.,Gabriel Shan,Female,62,1278686694,naveen28@example.com,"51/854, Kota Circle, Pali 734467"
FIR100626,Vandalism,Critical,Pending,2025-03-29,00:01:32,Goregaon West Ext,Mumbai,Maharashtra,19.151500827033267,72.86186849244052,Ullam sint dolor laboriosam omnis consectetur distinctio modi modi nemo nostrum officia reiciendis.,Jyoti Iyer,Female,57,+912029390878,choudhurydhruv@example.com,"159, Mander Path, Morbi 916170"
FIR100627,Vandalism,Medium,Active,2025-11-28,02:17:01,Jogeshwari East Ext Ext Ext Ext,Mumbai,Maharashtra,19.123490252515253,72.82762900899876,Eius labore aliquam facere nesciunt eum qui.,Daksha Kibe,Other,24,8443448123,garaekanta@example.com,"218, Ravel Zila, Baranagar 344760"
FIR100628,Theft,Low,Resolved,2025-10-26,15:30:07,Malad East,Mumbai,Maharashtra,19.18066194068432,72.86662764614412,Ut repellat assumenda qui itaque quam eligendi molestiae tempore adipisci vitae neque illo.,Jyoti Tak,Other,44,+918340242403,dharhemang@example.net,"77/402, Dass, Tumkur 302650"
FIR100629,Burglary,Low,Active,2025-03-09,09:59:18,Goregaon West,Mumbai,Maharashtra,19.163586767796037,72.84980504263436,Quas aliquam occaecati recusandae expedita laborum eum ex deserunt necessitatibus quisquam.,Yatan Dora,Female,18,+918105955184,abeerraj@example.org,"H.No. 836, Sethi Marg, Amravati-666102"
FIR100630,Domestic Violence,Medium,Active,2025-06-24,01:46:12,Kandivali East Ext,Mumbai,Maharashtra,19.203561597385768,72.85715324235125,Odit dolores hic consequuntur facere eius esse deleniti doloremque delectus aspernatur natus dolorum velit dolorem.,Nimrat Bajwa,Female,44,2694500534,ramjagdish@example.org,"420, Dave Street, Muzaffarnagar 998013"
FIR100631,Drug Offense,High,Pending,2025-12-31,21:59:36,Borivali West,Mumbai,Maharashtra,19.232220758706934,72.84784071773305,Sed tempore ab voluptate qui vitae asperiores explicabo itaque omnis delectus placeat.,Hiral Andra,Female,33,+914089164983,borahanmol@example.net,"36/75, Babu, Bhalswa Jahangir Pur-915244"
FIR100632,Kidnapping,High,Active,2025-02-11,01:50:27,Wadala,Mumbai,Maharashtra,19.019516699896595,72.86189668952741,Facere officiis quaerat quidem perferendis eaque vel sed ipsum vel maiores nisi.,Aarav Puri,Male,55,03543962736,sraju@example.net,"H.No. 40, Gala, Sambalpur-174656"
FIR100633,Murder,Low,Resolved,2025-12-26,08:37:05,Andheri West Ext,Mumbai,Maharashtra,19.13093160086581,72.82801931830349,Iste praesentium magnam minima voluptas nesciunt soluta officia tempore consequatur voluptate autem unde.,Hemang Jha,Female,24,02717272239,vsengupta@example.org,"01, Rajagopal Circle, Unnao 631995"
FIR100634,Fraud,Low,Active,2025-07-28,23:53:48,Colaba Ext,Mumbai,Maharashtra,18.90507345928189,72.81020166254027,Iste consequuntur pariatur unde accusantium quidem est.,Oni Swamy,Male,61,02404226931,wkrishna@example.net,"H.No. 92, Sunder Street, Gandhinagar-149003"
FIR100635,Domestic Violence,High,Pending,2025-04-23,11:49:45,Mulund West Ext,Mumbai,Maharashtra,19.158815665016498,72.95353021325676,Voluptates quos eos autem ipsam pariatur modi accusamus.,Lucky Mammen,Other,40,+911637618209,jsrinivas@example.com,"551, Madan Ganj, Rohtak 722883"
FIR100636,Assault,Critical,Pending,2025-04-14,08:53:29,Mulund West Ext Ext,Mumbai,Maharashtra,19.162524504888097,72.95680985022548,Atque suscipit veritatis voluptates mollitia illum aspernatur in veritatis corrupti inventore.,Caleb Kata,Other,58,+916601002314,udarsh24@example.net,"33, Krishnan Zila, Bally 157493"
FIR100637,Vandalism,Medium,Resolved,2025-12-10,02:27:09,Ghatkopar West Ext,Mumbai,Maharashtra,19.089443027114974,72.90425913393388,Error veniam libero possimus natus impedit aspernatur rem voluptatem magnam iure.,Kashish Shanker,Female,76,+919001851327,lipikakurian@example.org,"H.No. 149, Vora Chowk, Giridih-312040"
FIR100638,Murder,Low,Pending,2026-01-18,20:09:25,Ghatkopar East Ext,Mumbai,Maharashtra,19.075978216036916,72.91452003882989,Doloremque culpa iure aliquid eligendi eos ratione.,Girish Tiwari,Other,28,7245723084,ansh64@example.org,"776, Chandran Marg, Faridabad 800187"
FIR100639,Kidnapping,Low,Active,2025-07-24,23:33:48,Jogeshwari West Ext,Mumbai,Maharashtra,19.14209993974901,72.84227093136131,Iure consequatur saepe optio quo necessitatibus nostrum.,Meera Borde,Other,59,8100184186,sharafnirja@example.net,"H.No. 39, Nair Zila, Amritsar-367862"
FIR100640,Drug Offense,High,Pending,2025-06-11,07:16:45,Borivali East,Mumbai,Maharashtra,19.22518502623598,72.85608323594587,Omnis ducimus repellat perspiciatis quidem odit animi reiciendis dolorem voluptatem rem ipsam nisi qui.,Radhika De,Other,70,+910303662543,neelimadass@example.net,"81, Shan Circle, Ranchi 856425"
FIR100641,Theft,Medium,Resolved,2025-05-25,00:39:42,Jogeshwari East Ext Ext Ext,Mumbai,Maharashtra,19.126716533081176,72.83743652919082,Nemo ea sapiente cum iusto eligendi minima autem vel deleniti at incidunt voluptate doloribus dolorum repellendus.,Bishakha Lal,Other,50,6172131451,sathvik66@example.com,"80, Sangha Street, Sambalpur-542306"
FIR100642,Kidnapping,High,Pending,2025-12-11,14:33:47,Kandivali East,Mumbai,Maharashtra,19.20457836625502,72.86463776526257,Porro repellendus atque ratione cumque facilis aspernatur repellendus animi doloribus doloribus quis.,Maya Narain,Male,67,5151092268,csethi@example.com,"302, Sankaran Circle, Thanjavur 522411"
FIR100643,Murder,Medium,Pending,2025-12-01,15:38:34,Bhandup Ext,Mumbai,Maharashtra,19.15734620728459,72.9304717873259,Dicta sapiente explicabo fugit placeat eos voluptas recusandae quos ex fugit.,Sneha Magar,Male,53,09262494514,vpatla@example.com,"H.No. 667, Chauhan Nagar, Aurangabad 599201"
FIR100644,Kidnapping,Medium,Pending,2025-12-31,19:39:59,Kandivali West Ext Ext,Mumbai,Maharashtra,19.21496424943019,72.85160242359682,At officiis culpa commodi reprehenderit ducimus odio beatae saepe tempore odit adipisci.,Falan Jain,Female,54,05410225267,udeol@example.net,"382, Deshmukh Street, Alwar-053922"
FIR100645,Murder,Medium,Resolved,2025-04-25,23:31:20,Malad East Ext Ext Ext,Mumbai,Maharashtra,19.183579785359974,72.85501366208665,Laborum dolorum illo nesciunt amet alias sit.,Ikbal Dugal,Female,58,7119642152,yatankalla@example.net,"H.No. 62, Chandran Nagar, Aurangabad-348433"
FIR100646,Murder,Low,Pending,2025-04-23,10:01:19,Borivali East Ext,Mumbai,Maharashtra,19.222118461769835,72.8465724376748,Asperiores perferendis eaque officia incidunt unde omnis veniam quibusdam.,Nitesh Sengupta,Female,76,+916557676952,robertpatla@example.com,"252, Radhakrishnan Circle, Kakinada 394564"
FIR100647,Cybercrime,Critical,Pending,2025-02-05,13:03:20,Dadar Ext,Mumbai,Maharashtra,19.01515614103687,72.84069999216602,Repellendus natus pariatur et incidunt commodi illum vitae est quisquam necessitatibus nostrum.,Dipta Ray,Other,34,3668788788,pprasad@example.com,"428, Misra Marg, Phagwara 602498"
FIR100648,Fraud,High,Active,2025-10-10,02:34:54,Kurla West Ext,Mumbai,Maharashtra,19.073682581438515,72.88841895123711,Quasi impedit praesentium modi sed eveniet distinctio quis voluptatum et voluptas.,Ishita Johal,Other,52,+916196893135,mayadhaliwal@example.com,"420, Parikh, Junagadh-734985"
FIR100649,Vandalism,Critical,Resolved,2025-04-12,19:00:38,Bhandup Ext Ext Ext,Mumbai,Maharashtra,19.158555416576064,72.93200130834971,Minus quam numquam animi autem sed neque sequi est adipisci reiciendis consequatur expedita.,Darika Sheth,Male,65,+913058721055,sethicharita@example.net,"561, Goel Path, Sambhal-591476"
FIR100650,Cybercrime,High,Pending,2025-06-30,05:25:22,Lower Parel Ext,Mumbai,Maharashtra,19.006021411198407,72.84186083390317,Nihil repudiandae maiores possimus veniam qui occaecati soluta cupiditate maxime excepturi unde.,Jagdish Chana,Male,22,+914728633302,mbehl@example.org,"809, Saha Marg, Vasai-Virar-753369"
FIR100651,Drug Offense,Medium,Resolved,2025-06-03,06:17:59,Goregaon West,Mumbai,Maharashtra,19.170809285945026,72.85226299412939,Et sit quaerat magni nesciunt sunt occaecati iste distinctio ea ratione eos consectetur debitis.,Daksha Baria,Female,65,+912606501917,naksh68@example.com,"H.No. 74, Saraf Marg, Muzaffarpur 389629"
FIR100652,Cybercrime,Low,Pending,2025-05-15,20:53:29,Bandra West,Mumbai,Maharashtra,19.055171225860384,72.84340575642456,Laudantium laboriosam eligendi tenetur natus eaque nesciunt alias incidunt rem aliquid ab necessitatibus soluta.,Falak Divan,Male,49,2025213109,saanvibajwa@example.net,"436, Dora Chowk, Kota 712763"
FIR100653,Burglary,Critical,Pending,2025-12-28,20:37:41,Bandra East,Mumbai,Maharashtra,19.059771211593006,72.84554492204005,Hic molestias commodi qui itaque rem rem libero nisi.,Yuvraj Parekh,Male,20,02272847657,libnigera@example.com,"H.No. 34, Narasimhan Marg, Shahjahanpur-616824"
FIR100654,Burglary,Low,Pending,2025-02-22,07:34:20,Dadar Ext Ext,Mumbai,Maharashtra,19.024733734830523,72.84337314827226,Expedita officiis enim rem accusantium aut commodi suscipit ducimus iusto similique ducimus voluptate quasi nobis.,Yochana Bawa,Male,69,0412009282,neelimahora@example.org,"98/16, Pandya Zila, Orai-168371"
FIR100655,Vandalism,High,Active,2025-11-23,17:55:36,Dadar,Mumbai,Maharashtra,19.015310013832625,72.84709985214121,At ipsa nemo voluptatibus sequi repellendus consequuntur.,Abha Ghosh,Male,64,+916678498436,dnadig@example.org,"H.No. 737, Raghavan Street, Chittoor 014896"
FIR100656,Kidnapping,Low,Active,2025-05-15,21:19:16,Jogeshwari East Ext,Mumbai,Maharashtra,19.13103863773016,72.85775816211103,Quia iusto ipsam corporis veritatis facere vel recusandae provident eos commodi hic animi consectetur animi repudiandae.,Nidhi Sethi,Male,79,+914186236903,vidhimutti@example.net,"26/49, Dalal Ganj, Bhilai-639476"
FIR100657,Fraud,Low,Active,2025-06-12,12:48:56,Dadar,Mumbai,Maharashtra,19.01638578461525,72.85279557703251,Error perferendis nisi vel ea eaque culpa nam facere placeat doloribus at sed nihil eaque impedit.,Girindra Shere,Female,52,02891775662,chatterjeedhruv@example.org,"42/926, Padmanabhan Road, Tiruppur-917299"
FIR100658,Vandalism,Critical,Resolved,2025-10-03,16:15:51,Cuffe Parade,Mumbai,Maharashtra,18.91176631073708,72.82309448894082,Excepturi reiciendis non quibusdam explicabo numquam sapiente quasi soluta cupiditate quam.,Logan Dara,Female,69,+915634111595,anandchatresh@example.com,"694, Buch Circle, Bokaro 649719"
FIR100659,Murder,Medium,Resolved,2025-08-12,13:14:18,Goregaon East Ext,Mumbai,Maharashtra,19.154033564153934,72.86515158631491,Laudantium soluta perspiciatis sint reiciendis ipsa autem dolorem.,David Kapadia,Male,31,+913428113904,munshiishanvi@example.org,"06/833, Kannan Path, Patna-612590"
FIR100660,Assault,Low,Active,2025-07-01,00:56:41,Jogeshwari East Ext,Mumbai,Maharashtra,19.12805242880149,72.8539436207198,Ut eius ad distinctio vitae hic pariatur consectetur harum.,Rudra Rattan,Female,65,+918303419909,tanaymohanty@example.org,"39/949, Bumb Nagar, Kamarhati 443767"
FIR100661,Fraud,Medium,Resolved,2025-10-17,01:48:26,Jogeshwari East Ext Ext Ext Ext Ext Ext,Mumbai,Maharashtra,19.111874982806942,72.84976007526173,Illum repellendus quae quisquam eius aliquam quas harum optio aut cum fugiat magnam vero.,Frado Lad,Other,78,00051405468,diya97@example.com,"14/09, Lanka Circle, Ghaziabad-679301"
FIR100662,Fraud,High,Pending,2025-12-20,01:13:36,Goregaon West Ext,Mumbai,Maharashtra,19.159808839206445,72.85691892299128,Expedita vel provident rem minus nobis alias.,Anthony Bhattacharyya,Male,78,+915652156818,parth44@example.org,"H.No. 604, Chacko, Nashik 202886"
FIR100663,Murder,Low,Pending,2025-08-23,18:59:08,Andheri West Ext,Mumbai,Maharashtra,19.127510759047144,72.82743132856295,Perspiciatis excepturi explicabo recusandae ut voluptate veniam ipsam ut in laboriosam.,Sachi Dave,Other,48,+910967904227,maxgade@example.com,"80, Baral Zila, Jalna-134854"
FIR100664,Murder,Critical,Pending,2025-06-04,00:29:03,Andheri West,Mumbai,Maharashtra,19.11680852782963,72.82800411556114,Delectus numquam et eaque tenetur dolorem odit sunt deserunt ratione quaerat.,Garima Das,Female,48,+911332288985,walianimrat@example.org,"H.No. 353, Sandal Zila, Morena 791386"
FIR100665,Theft,High,Active,2026-01-26,14:21:27,Borivali West,Mumbai,Maharashtra,19.230389299633256,72.8442058075746,Vitae non quo neque aspernatur vero blanditiis accusamus fugit laudantium quidem architecto deserunt occaecati dolorum.,Triya Bedi,Female,34,02545960633,smand@example.org,"H.No. 71, Tandon Zila, Kurnool 194024"
FIR100666,Vandalism,High,Resolved,2025-02-06,11:02:47,Mulund West Ext Ext,Mumbai,Maharashtra,19.15859767286115,72.9550351934988,Harum soluta pariatur fugit ratione rerum dolor libero facere explicabo dolorum voluptas explicabo a necessitatibus.,Rachita Rana,Other,77,9129710248,dinsai@example.org,"881, Chanda Road, Mira-Bhayandar-452719"
FIR100667,Murder,Critical,Active,2025-03-12,03:03:36,Bhandup,Mumbai,Maharashtra,19.14775221772106,72.94130605717214,Aperiam iste adipisci repellat voluptates amet numquam sapiente iusto sed.,Ayushman Raja,Female,41,+917175242149,deshmukhlakshmi@example.com,"85, Rai Chowk, Haldia-913810"
